,,Rubro,Artículo,Nombre,Bt.LISTA 2
,,ACEITES Y VINAGRES,1002,ACEITE DE OLIVA  X 500 CC LAUR,"11080,00"
,,ACEITES Y VINAGRES,1007,ACEITE DE OLIVA X 5 L R.V.,"76570,00"
,,ACEITES Y VINAGRES,1008,ACEITE DE OLIVA  R.V X 3 L,"46360,00"
,,ACEITES Y VINAGRES,1009,ACEITE DE OLIVA EV R.V 500 CC,"9650,00"
,,ACEITES Y VINAGRES,1010,ACEITE DE OLIVA EV R.V 900 CC,"14990,00"
,,ACEITES Y VINAGRES,1011,ACEITE DE OLIVA  1 L PANNOCCHIA,"17960,00"
,,ACEITES Y VINAGRES,1012,ACEITE DE OLIVA  1 L VID. LAUR,"22150,00"
,,ACEITES Y VINAGRES,1013,ACEITE DE OLIVA 1/2 L VID. PANNOCCHIA,"10890,00"
,,ACEITES Y VINAGRES,1014,ACEITE DE OLIVA EV X 5 L PANNOCCHIA,"85280,00"
,,ACEITES Y VINAGRES,1064,"ACETO BALSAMICO 500 CC PET ""CRISTO DE LOS CERROS""","4110,00"
,,ACEITES Y VINAGRES,1066,"ACETO REDUCCIÓN X 500 CC ""RECETAS DE ENTONCES""","7490,00"
,,ACEITES Y VINAGRES,1637,VINAGRE DE ALCOHOL X 1 L,"1220,00"
,,ACEITES Y VINAGRES,1638,VINAGRE DE MANZANA X 1 L,"2320,00"
,,ACEITES Y VINAGRES,1639,VINAGRE DE VINO X 1 L,"1470,00"
,,ACEITES Y VINAGRES,1894,ACEITE DE OLIVA X 900ML VERDE OLIVA,"4640,00"
,,ACEITES Y VINAGRES,1908,ACEITE DE OLIVA X 3 L VERDE OLIVA,"14550,00"
,,ACEITES Y VINAGRES,1909,ACEITEDE OLIVA X 5 L VERDE OLIVA,"23100,00"
,,ACEITES Y VINAGRES,2119,ACEITE OLIVA X 500 PET VERDE OLIVA ,"2990,00"
,,ACEITES Y VINAGRES,2141,"ACEITE COCO NEUTRO ENTRENUTS ""SIN TACC"" x 360 G","6560,00"
,,ACEITES Y VINAGRES,2142,"ACEITE COCO VIRGEN ENTRENUTS ""SIN TACC"" X 200 g","7390,00"
,,ACEITES Y VINAGRES,2265,"ACEITE COCO NEUTRO ENTRENUTS ""SIN TACC"" x 200","4290,00"
,,ACEITES Y VINAGRES,2266,"ACEITE COCO VIRGEN ENTRENUTS ""SIN TACC"" X 360 g","13680,00"
,,ACEITES Y VINAGRES,2416,ACETO BALSAMICO MILLAN X 250,"0,00"
,,ACEITUNAS,1018,ACEITUNAS DESC. X 5 KG ,"35220,00"
,,ACEITUNAS,1020,ACEITUNAS DESCAROZADAS X 1 KG,"8970,00"
,,ACEITUNAS,1021,ACEITUNAS FILETEADAS X 1 KG.,"9430,00"
,,ACEITUNAS,1023,ACEITUNAS FILETEADAS  4 KG,"29960,00"
,,ACEITUNAS,1024,ACEITUNAS GRIEGAS X 1 KG,"11510,00"
,,ACEITUNAS,1025,ACEITUNAS GRIEGAS X 1/2 KG,"7960,00"
,,ACEITUNAS,1026,ACEITUNAS NEGRAS X 5 KG Nº 0,"47150,00"
,,ACEITUNAS,1028,ACEITUNAS NEGRAS X 5 KG Nº 1,"37040,00"
,,ACEITUNAS,1030,ACEITUNAS NEGRAS DESC. X 5 KG.,"39160,00"
,,ACEITUNAS,1031,ACEITUNAS NEGRAS FILET X 5 KG.,"41330,00"
,,ACEITUNAS,1032,ACEITUNAS NEGRAS X 1 KG.,"8350,00"
,,ACEITUNAS,1034,ACEITUNAS RELL.X 1 KG.,"12560,00"
,,ACEITUNAS,1036,ACEITUNAS RELL. X 200 GR,"3780,00"
,,ACEITUNAS,1037,ACEITUNAS RELL. SURTIDAS X 330 GR.,"6090,00"
,,ACEITUNAS,1038,ACEITUNAS VERDES DURANG N°0 X 5 KG ,"42990,00"
,,ACEITUNAS,1040,ACEITUNAS VERDES DURANG Nº 1 X 5 KG,"38210,00"
,,ACEITUNAS,1043,ACEITUNAS VERDES X 1 KG Nº 00,"10190,00"
,,ACEITUNAS,1044,ACEITUNAS VERDES X 1 KG Nº0,"9140,00"
,,ACEITUNAS,1045,ACEITUNAS VERDES X 1 KG Nº1,"7960,00"
,,ACEITUNAS,1049,ACEITUNAS VERDES X 1/2 KG Nº 00,"6620,00"
,,ACEITUNAS,1050,ACEITUNAS VERDES X 1/2 KG Nº 1,"4510,00"
,,ACEITUNAS,1051,ACEITUNAS VERDES X 1/2 KG Nº0,"5300,00"
,,ACEITUNAS,1056,ACEITUNAS VERDES X 5 KG N°0,"32380,00"
,,ACEITUNAS,1058,ACEITUNAS VERDES X 5 KG Nº1,"24580,00"
,,ACEITUNAS,1059,ACEITUNAS VERDES X 5 KG Nº2,"21800,00"
,,ACEITUNAS,2443,ACEITUNAS NEGRAS DESCAROZADAS X 3 KG,"25130,00"
,,"AZUCAR, CACAO Y REPOSTERIA",1140,AZUCAR IMPALPABLE X KG.,"2860,00"
,,"AZUCAR, CACAO Y REPOSTERIA",1141,AZUCAR MASCABO X KG,"5430,00"
,,"AZUCAR, CACAO Y REPOSTERIA",1142,AZUCAR NEGRA X KG.,"2830,00"
,,"AZUCAR, CACAO Y REPOSTERIA",1163,CACAO AMARGO DE BRASIL X KG.,"27830,00"
,,"AZUCAR, CACAO Y REPOSTERIA",1178,CASCARILLA DE CACAO X KG.,"5700,00"
,,"AZUCAR, CACAO Y REPOSTERIA",1211,COCO EN ESCAMAS X KG,"19360,00"
,,"AZUCAR, CACAO Y REPOSTERIA",1212,COCO RALLADO X KG.,"11290,00"
,,"AZUCAR, CACAO Y REPOSTERIA",1263,"ESENCIA ARTIFICIAL DE VAINILLA X 100 CC ""INDIAS"" ","920,00"
,,"AZUCAR, CACAO Y REPOSTERIA",2348,POLVO PARA HORNEAR X KG,"3590,00"
,,BEBIDAS,1324,"JUGO DE ARANDANOS X 1,5 LTS.","3080,00"
,,BEBIDAS,1325,"JUGO DE LIM, MENTA Y JENG X 1,5 LTS.","3080,00"
,,BEBIDAS,1727,LECHE DE COCO EN POLVO X KG,"27570,00"
,,CEREALES,1114,ALMOHADITAS 2 SALVADO X KG.,"5600,00"
,,CEREALES,1115,ALMOHADITAS CHOCOLATE X KG.,"9000,00"
,,CEREALES,1117,ALMOHADITAS FRUTILLA X KG.,"8400,00"
,,CEREALES,1118,ALMOHADITAS LIMON X KG.,"8400,00"
,,CEREALES,1121,ANILLOS DE AVENA Y MIEL X KG.,"7620,00"
,,CEREALES,1122,ANILLOS FRUTADOS X KG.,"6900,00"
,,CEREALES,1135,AVENA ARROLLADA GRUESA X KG,"2520,00"
,,CEREALES,1136,AVENA INSTANTÁNEA X KG,"2520,00"
,,CEREALES,1137,AVENA TRADICIONAL X KG.,"2520,00"
,,CEREALES,1147,BASTONCITO SALVADO TRIGO Y AVENA X KG.,"5640,00"
,,CEREALES,1155,BOLITAS DE CHOCOLATE X KG.,"7740,00"
,,CEREALES,1228,COPOS DE MAIZ C/AZUCAR X KG,"3420,00"
,,CEREALES,1229,COPOS DE MAIZ X KG.,"2980,00"
,,CEREALES,1286,GRANOLA MIX BERRIES X KG,"9330,00"
,,CEREALES,1287,GRANOLA MIX ENERGET X KG,"9330,00"
,,CEREALES,1289,GRANOLA MIX TROPICAL X KG,"9340,00"
,,CEREALES,1549,QUINOA INFLADA X KG.,"9670,00"
,,CEREALES,1635,TUTUCAS CON AZUCAR X KG,"3890,00"
,,CEREALES,1897,GRANOLA MIX SIN PASAS X KG,"5390,00"
,,CEREALES,1911,GRANOLA TRADICIONAL X KG,"5540,00"
,,CEREALES,1912,GRANOLA CON CHOCO X KG,"6360,00"
,,DESHIDRATADOS,1127,ARANDANOS DESHIDRATADOS X KG,"13250,00"
,,DESHIDRATADOS,1186,CEREZA GLASEADA X KG,"17130,00"
,,DESHIDRATADOS,1202,CHIPS DE BANANA X KG,"11000,00"
,,DESHIDRATADOS,1206,CIRUELA PRESIDENTE X KG.,"13990,00"
,,DESHIDRATADOS,1207,CIRUELAS D`AGEN C/CAROZO X KG,"8120,00"
,,DESHIDRATADOS,1208,CIRUELAS TIERNIZADAS S/C X KG,"10730,00"
,,DESHIDRATADOS,1242,DATILES DE EGIPTO C/C X KG,"6910,00"
,,DESHIDRATADOS,1271,FRUTA ESCURRIDA X KG,"4560,00"
,,DESHIDRATADOS,1272,FRUTA GLASEADA X KG,"0,00"
,,DESHIDRATADOS,1273,FRUTILLA GLASEADA X KG,"27670,00"
,,DESHIDRATADOS,1311,HIGOS TIERNIZADOS X KG,"12930,00"
,,DESHIDRATADOS,1319,JENGIBRE GLASEADO X KG,"18740,00"
,,DESHIDRATADOS,1394,MEDALLONES DURAZ.  X KG,"13720,00"
,,DESHIDRATADOS,1461,PASAS RUBIA SIN SLLA X KG,"7720,00"
,,DESHIDRATADOS,1488,PERAS WILLIAMS X KG,"12340,00"
,,DESHIDRATADOS,1632,TOMATE SECOS X KG,"11850,00"
,,DESHIDRATADOS,1954,FRUTA MULTICOLOR X KG,"7880,00"
,,DESHIDRATADOS,1955,PASAS MOROCHAS SIN SEMILLA X KG,"4760,00"
,,DESHIDRATADOS,2440,PASAS DE UVA CEREZA CON SEMILLA X KG,"2000,00"
,,"DULCES, MIEL Y CHOCOLATES",1129,ARROPE DE CHAÑAR X 600 GR,"5520,00"
,,"DULCES, MIEL Y CHOCOLATES",1130,ARROPE DE TUNA X 600 GR,"4220,00"
,,"DULCES, MIEL Y CHOCOLATES",1244,DULCE DE ALCAYOTA X 500 GR,"2430,00"
,,"DULCES, MIEL Y CHOCOLATES",1253,DULCE DE MEMBRILLO X 500 GR,"4690,00"
,,"DULCES, MIEL Y CHOCOLATES",1254,DULCE DE MEMBRILLO X 1 KG,"4510,00"
,,"DULCES, MIEL Y CHOCOLATES",1255,DULCE DE MEMBRILLO X 5 KG,"13230,00"
,,"DULCES, MIEL Y CHOCOLATES",1276,GARRAPIÑADA DE MANI X KG,"7610,00"
,,"DULCES, MIEL Y CHOCOLATES",1308,"HIGOS EN ALMIBAR X 3,8 KG","37580,00"
,,"DULCES, MIEL Y CHOCOLATES",1309,HIGOS EN ALMIBAR X 450 GR,"4860,00"
,,"DULCES, MIEL Y CHOCOLATES",1310,HIGOS EN ALMIBAR X 850 GR,"8670,00"
,,"DULCES, MIEL Y CHOCOLATES",1406,"MIEL DE ABEJA X 1 kg ""MONTE NATURAL"" - JALEA","5560,00"
,,"DULCES, MIEL Y CHOCOLATES",1408,"MIEL DE ABEJA X 250 g ""MONTE NATURAL"" - JALEA","2480,00"
,,"DULCES, MIEL Y CHOCOLATES",1410,"MIEL DE ABEJA X 500 g ""MONTE NATURAL"" - JALEA","3550,00"
,,"DULCES, MIEL Y CHOCOLATES",1655,"ZAPALLO EN ALMIBAR X 3,8 KG","31500,00"
,,"DULCES, MIEL Y CHOCOLATES",1656,ZAPALLO EN ALMIBAR X 360,"4570,00"
,,"DULCES, MIEL Y CHOCOLATES",1657,ZAPALLO EN ALMIBAR X 850 GR,"6460,00"
,,"DULCES, MIEL Y CHOCOLATES",1901,MERMELADA MQA CIRUELA X 310,"3640,00"
,,"DULCES, MIEL Y CHOCOLATES",1902,MERMELADA MQA FRUTILLA X 310,"4360,00"
,,"DULCES, MIEL Y CHOCOLATES",1903,MERMELADA MQA MEMBRILLO X 310,"3640,00"
,,"DULCES, MIEL Y CHOCOLATES",1904,MERMELADA MQA NARANJA X 310,"3640,00"
,,"DULCES, MIEL Y CHOCOLATES",1905,MERMELADA MQA MANZNANA X 310,"3640,00"
,,"DULCES, MIEL Y CHOCOLATES",1906,MERMELADA NARANJA/ZANAHORIA,"4360,00"
,,"DULCES, MIEL Y CHOCOLATES",1907,MERMELADA MQA DURAZNO X 310,"3640,00"
,,"DULCES, MIEL Y CHOCOLATES",2403,DULCE DE ALCAYOTA X 1 KG,"4780,00"
,,ENCURTIDOS,1067,ADEREZO  DE PICKLES X 200 GR.,"2940,00"
,,ENCURTIDOS,1081,AJIES DULCES X 1 KG,"18030,00"
,,ENCURTIDOS,1082,AJIES DULCES X 110 GR,"2980,00"
,,ENCURTIDOS,1083,AJIES PICANTES X 1 KG,"18030,00"
,,ENCURTIDOS,1084,AJIES PICANTES X 110 GR,"2980,00"
,,ENCURTIDOS,1100,ALCAPARRAS X 100 GR,"6090,00"
,,ENCURTIDOS,1101,CORAZON DE  ALCAUCIL CONDIM X 330 GR,"7940,00"
,,ENCURTIDOS,1150,BERENJENAS CONDIM.X 200 GR,"3540,00"
,,ENCURTIDOS,1185,CEBOLLITAS EN VINAGRE X 330 GR,"3710,00"
,,ENCURTIDOS,1204,CHUCRUT X 600 GR,"8040,00"
,,ENCURTIDOS,1230,CORAZONES DE ALCAUCIL X 300 GR,"6730,00"
,,ENCURTIDOS,1264,ESPARRAGOS X 250 GR,"7480,00"
,,ENCURTIDOS,1483,PEPINILLOS EN VIN. X 200 GR,"3240,00"
,,ENCURTIDOS,1484,PEPINILLOS EN VINX 2 KG,"20150,00"
,,ENCURTIDOS,1485,PEPINOS AGRIDULCES X 2 KG,"15640,00"
,,ENCURTIDOS,1486,PEPINOS AGRID X 200 GR,"3440,00"
,,ENCURTIDOS,1498,PICKLES GARRAFA X 1 KG.,"6900,00"
,,ENCURTIDOS,1500,PICKLES MIXTOS X 2 KG,"15980,00"
,,ENCURTIDOS,1501,PICKLES MIXTOS X 200 GR,"2440,00"
,,ENCURTIDOS,1517,PIMIENTOS ENTEROS X 200 GR ,"3800,00"
,,ENCURTIDOS,1518,PIMIENTOS X 3 KG DURANG,"27940,00"
,,ENCURTIDOS,1530,POROTOS CONDIM X 200 GR,"3310,00"
,,ENCURTIDOS,2434,ALCAPARRAS X 500,"13010,00"
,,ESPECIAS,1068,ADOBO PARA PIZZA X KG.,"8280,00"
,,ESPECIAS,1079,AJI MOLIDO FINO X KG.,"7820,00"
,,ESPECIAS,1085,AJO EN POLVO,"5380,00"
,,ESPECIAS,1088,AJO GRANULADO X KG.,"12190,00"
,,ESPECIAS,1099,ALBAHACA EN HOJAS X KG,"7510,00"
,,ESPECIAS,1123,ANIS EN GRANO X KG.,"10800,00"
,,ESPECIAS,1124,ANIS ESTRELLADO X KG.,"52020,00"
,,ESPECIAS,1138,AZAFRAN ESPAÑOL X CAPSULA.,"2640,00"
,,ESPECIAS,1167,CANELA EN RAMA X KG,"63720,00"
,,ESPECIAS,1168,CANELA MOLIDA X KG.,"12380,00"
,,ESPECIAS,1176,CARDAMOMO X KG.,"119820,00"
,,ESPECIAS,1182,CEBOLLA EN ESCAMAS X KG.,"9870,00"
,,ESPECIAS,1201,CHIMICHURRI X KG.,"8840,00"
,,ESPECIAS,1209,CLAVO DE OLOR ENTERO X KG.,"32890,00"
,,ESPECIAS,1214,COMINO MOLIDO X KG.,"9910,00"
,,ESPECIAS,1219,CONDIMENTO PARA ARROZ X KG,"9120,00"
,,ESPECIAS,1236,CURCUMA MOLIDA X KG,"8840,00"
,,ESPECIAS,1239,CURRY X KG,"11040,00"
,,ESPECIAS,1270,FINAS HIERBAS X KG.,"13450,00"
,,ESPECIAS,1314,HONGOS SECOS X KG,"41680,00"
,,ESPECIAS,1320,JENGIBRE MOLIDO X KG.,"13670,00"
,,ESPECIAS,1333,JULIANA SIN PAPA X KG,"12490,00"
,,ESPECIAS,1350,LAUREL EN HOJAS X KG.,"22600,00"
,,ESPECIAS,1363,MACA EN POLVO X KG.,"18230,00"
,,ESPECIAS,1418,MIX  4 PIMIENTAS,"41080,00"
,,ESPECIAS,1436,MOSTAZA EN GRANOS X KG,"5770,00"
,,ESPECIAS,1451,NUEZ MOSCADA ENTERA X KG,"40480,00"
,,ESPECIAS,1452,NUEZ MOSCADA MOLIDA X KG.,"16260,00"
,,ESPECIAS,1455,OREGANO  KG.,"6460,00"
,,ESPECIAS,1489,PEREJIL EN HOJAS X KG.,"13030,00"
,,ESPECIAS,1495,PESTO X KG,"9260,00"
,,ESPECIAS,1502,PIMENTON AHUMADO X KG,"9020,00"
,,ESPECIAS,1505,PIMENTON EXTRA X KG,"8930,00"
,,ESPECIAS,1506,PIMENTÓN PICANTE X KG,"8580,00"
,,ESPECIAS,1508,PIMIENTA BCA  EN GRANO X KG,"40480,00"
,,ESPECIAS,1510,PIMIENTA BCA MOLIDA X KG,"41050,00"
,,ESPECIAS,1511,PIMIENTA CAYENA MOLIDA X KG.,"9900,00"
,,ESPECIAS,1512,PIMIENTA NEGRA EN GRANO X KG.,"23020,00"
,,ESPECIAS,1513,PIMIENTA NEGRA MOLIDA X KG,"26750,00"
,,ESPECIAS,1545,PROVENZAL X KG.,"12360,00"
,,ESPECIAS,1555,ROMERO EN HOJAS X KG.,"11120,00"
,,ESPECIAS,1557,SAL DEL HIMALAYA FINA X 1 KG,"3520,00"
,,ESPECIAS,1558,SAL DEL HIMALAYA GRUESA X KG.,"4250,00"
,,ESPECIAS,1561,SAL MARINA FINA X 500 GR.,"2520,00"
,,ESPECIAS,1562,SAL MARINA GRUESA X 500 GR,"2490,00"
,,ESPECIAS,1633,TOMILLO X KG,"9560,00"
,,ESPECIAS,1702,GELATINA SIN SABOR X KG,"18490,00"
,,ESPECIAS,2089,BICARBONATO DE SODIO X KG,"2620,00"
,,FRUTOS SECOS,1134,AVELLANAS SIN CASCARA X KG,"40040,00"
,,FRUTOS SECOS,1180,CASTAÑAS CAJÚ VIETNAM  X KG,"16610,00"
,,FRUTOS SECOS,1365,MAIZ FRITO SALADO X KG,"12480,00"
,,FRUTOS SECOS,1375,MANI C/CASCARA X KG,"4650,00"
,,FRUTOS SECOS,1378,MANI JAPONES,"7060,00"
,,FRUTOS SECOS,1379,MANI SABORIZADO X KG,"4780,00"
,,FRUTOS SECOS,1380,MANI TOSTADO SALADO X KG,"3940,00"
,,FRUTOS SECOS,1381,MANI TOSTADO X KG.,"3920,00"
,,FRUTOS SECOS,1416,MIX CERVECERO X KG,"6750,00"
,,FRUTOS SECOS,1420,MIX DE FR SECOS/ CEREALES X KG,"11020,00"
,,FRUTOS SECOS,1426,MIX PATAGONICO X KG,"13710,00"
,,FRUTOS SECOS,1429,MIX TRADICIONAL X KG,"5420,00"
,,FRUTOS SECOS,1430,MIX TROPICAL X KG.,"8330,00"
,,FRUTOS SECOS,1441,NUEZ CUARTILLO X KG,"12000,00"
,,FRUTOS SECOS,1444,NUEZ CUARTOS EXTRA LIGHT X KG. ,"15180,00"
,,FRUTOS SECOS,1445,NUEZ CUARTOS LIGTH X KG,"13860,00"
,,FRUTOS SECOS,1446,NUEZ CON CASCARA X KG,"0,00"
,,FRUTOS SECOS,1448,NUEZ MARIPOSA AMBAR X KG,"0,00"
,,FRUTOS SECOS,1450,NUEZ MARIPOSA LIGHT X KG,"16800,00"
,,FRUTOS SECOS,1522,PISTACHOS CON CÁSCARA X KG,"35110,00"
,,FRUTOS SECOS,1660,MIX SALADO X KG,"11930,00"
,,FRUTOS SECOS,1716,NUEZ MARIPOSA EXTRA LIGHT X KG,"18000,00"
,,FRUTOS SECOS,1842,ALMENDRA NONPAREIL  X KG,"21580,00"
,,FRUTOS SECOS,2228,MIX SIN PASAS PREMIUM X KG,"14670,00"
,,FRUTOS SECOS,2369,PISTACHOS NATURALES SIN CÁCARA X KG,"72080,00"
,,GRANOS Y LEGUMBRES,1131,ARROZ INTEGRAL X KG.,"2300,00"
,,GRANOS Y LEGUMBRES,1133,ARROZ YAMANI X KG.,"3160,00"
,,GRANOS Y LEGUMBRES,1240,CUSCUS X KG,"11340,00"
,,GRANOS Y LEGUMBRES,1358,LENTEJAS TURCAS X KG,"4510,00"
,,GRANOS Y LEGUMBRES,1359,LENTEJAS X KG.,"3920,00"
,,GRANOS Y LEGUMBRES,1364,MAIZ BCO PISADO PARTIDO X KG,"3220,00"
,,GRANOS Y LEGUMBRES,1366,MAIZ PISCINGALLO X KG,"2180,00"
,,GRANOS Y LEGUMBRES,1525,POROTO ALUBIA KG,"3790,00"
,,GRANOS Y LEGUMBRES,1526,POROTO COLORADO X KG.,"4020,00"
,,GRANOS Y LEGUMBRES,1527,POROTO MANTECA X KG.,"4670,00"
,,GRANOS Y LEGUMBRES,1528,POROTO MUNG X KG,"2740,00"
,,GRANOS Y LEGUMBRES,1529,POROTO NEGRO X KG.,"2740,00"
,,GRANOS Y LEGUMBRES,1532,POROTOS DE SOJA X KG,"2320,00"
,,GRANOS Y LEGUMBRES,1533,POROTOS PALLARES X KG,"7420,00"
,,GRANOS Y LEGUMBRES,1634,TRIGO BURGOL X KG,"3730,00"
,,GRANOS Y LEGUMBRES,2335,GARBANZOS X KG,"2590,00"
,,HARINAS,1113,ALMIDON DE MAIZ X KG,"1890,00"
,,HARINAS,1269,FECULA DE MANDIOCA X KG,"2850,00"
,,HARINAS,1281,GERMEN DE TRIGO NATURAL X KG.,"2030,00"
,,HARINAS,1282,GLUTEN DE TRIGO X KG,"8040,00"
,,HARINAS,1291,HARINA DE ALGARROBA X KG,"6040,00"
,,HARINAS,1293,HARINA ALMENDRAS S/ PIEL X KG,"24770,00"
,,HARINAS,1294,HARINA DE ARROZ X KG,"2050,00"
,,HARINAS,1295,HARINA DE AVENA X KG,"2800,00"
,,HARINAS,1296,HARINA DE CENTENO X KG,"2330,00"
,,HARINAS,1297,HARINA DE CHIA X KG.,"2410,00"
,,HARINAS,1298,HARINA DE COCO X KG,"8050,00"
,,HARINAS,1299,HARINA DE GARBANZO X KG,"2070,00"
,,HARINAS,1300,HARINA DE LINO X KG,"3520,00"
,,HARINAS,1305,HARINA SOJA DESGR FINA X KG,"2490,00"
,,HARINAS,1306,HARINA INTEGRAL FINA X KG.,"1790,00"
,,HARINAS,1576,SALVADO DE AVENA X KG,"2790,00"
,,HARINAS,1588,SEMOLIN DE TRIGO X KG,"1680,00"
,,HARINAS,1621,TEXTURIZADO DE SOJA X KG,"2860,00"
,,HARINAS,1670,PANKO X KG,"2910,00"
,,INFUSIONES Y HIERBAS,1154,BOLDO X KG,"16640,00"
,,INFUSIONES Y HIERBAS,1384,MANZANILLA FLOR X KG,"26120,00"
,,INFUSIONES Y HIERBAS,1618,TE NEGRO X KG ,"7470,00"
,,INFUSIONES Y HIERBAS,1619,TE ROJO X KG,"7470,00"
,,INFUSIONES Y HIERBAS,1849,HIBISCUS FLOR X KG,"17180,00"
,,INFUSIONES Y HIERBAS,2048,TE VERDE X KG,"7470,00"
,,LINEA GOURMET,1188,"CEREZAS AL MARRASCHINO X 170 g ""AGROIANNI""","4920,00"
,,LINEA GOURMET,1193,"CEREZAS AL MARRASCHINO X 330 g ""AGROIANNI""","6490,00"
,,LINEA GOURMET,1312,HOJAS DE PARRA X 500 GR,"17900,00"
,,LINEA GOURMET,1316,HUMO NATURAL X 250 ML,"3700,00"
,,LINEA GOURMET,1462,"PASTA ACEITUNAS CONDIM. X 110 g ""AGROIANNI""","3460,00"
,,LINEA GOURMET,1463,"PASTA ACEITUNAS NEGRAS X 200 g ""AGROIANNI""","2980,00"
,,LINEA GOURMET,1464,"PASTA ACEITUNAS VERDES X 200 g ""AGROIANNI""","3130,00"
,,LINEA GOURMET,1465,PASTA DE AJI PICANTE X 90 GR,"3050,00"
,,LINEA GOURMET,1468,"PASTA DE AJOS X 200 g ""AGROIANNI""","2510,00"
,,LINEA GOURMET,1564,SALSA BARBACOA X 250 GR,"4900,00"
,,LINEA GOURMET,1571,SALSA DE SOJA X 180 CC,"3720,00"
,,LINEA GOURMET,1572,SALSA INGLESA X 180CC.,"4780,00"
,,LINEA GOURMET,1573,SALSA JALAPEÑO ROJA X 180 CC,"5270,00"
,,LINEA GOURMET,1575,SALSA TERIYAKI X 250 CC,"4360,00"
,,LINEA GOURMET,1681,DURAZNOS EN MITADES X 800 GR,"4890,00"
,,LINEA GOURMET,1683,SALSA JALAPEÑO VERDE X 180 CC,"5270,00"
,,LINEA GOURMET,1687,SALSA AJI PICANTE X 180 CC,"5070,00"
,,LINEA GOURMET,1720,SALSA JALAPEÑO AHUMADA X 180,"5270,00"
,,LINEA GOURMET,1803,SALSA CESAR 250 GR,"4900,00"
,,LINEA GOURMET,2330,PASTA ALCAUCILES X 200,"2560,00"
,,MANTECAS Y PASTAS,1383,"MANTEQUILLA DE MANI ""ENTRENUTS"" X 370 g","2840,00"
,,PRODUCTOS DE FRIO,1809,YOGHURT NATURAL AZUCARADO X 1 L,"4130,00"
,,PRODUCTOS DE FRIO,1810,YOGHURT NATURAL SIN AZUCAR X 1 L,"4130,00"
,,PRODUCTOS DE FRIO,1811,YOGHURT FRUTILLA X 1 L,"4600,00"
,,PRODUCTOS DE FRIO,1812,YOGHURT DURAZNO X 1 L,"4590,00"
,,PRODUCTOS DE FRIO,1879,YOGHURT ANANA X 1 L,"4590,00"
,,PRODUCTOS SIN TACC,1539,PREMEZCLA P/PANIFI S/ TACC X 1 KG,"6080,00"
,,PRODUCTOS SIN TACC,1540,PREMEZCLA P/PANIF S/TACC X 5 KG,"27650,00"
,,PRODUCTOS SIN TACC,1553,REBOZADOR S/GLUTEN X 500 GR,"3780,00"
,,SEMILLAS,1259,ENELDO SEMILLAS X KG,"8110,00"
,,SEMILLAS,1414,MIX 10 SEMILLAS SALUD X KG,"6930,00"
,,SEMILLAS,1415,MIX 7 SEMILLAS SALUD X KG,"5880,00"
,,SEMILLAS,1421,MIX DE SLLAS  ADELGAZ X KG,"5860,00"
,,SEMILLAS,1422,MIX SLLAS PARA ENSALADA X KG,"7040,00"
,,SEMILLAS,1551,QUINOA X KG,"9940,00"
,,SEMILLAS,1581,SEMILLA DE AMAPOLA X KG.,"14670,00"
,,SEMILLAS,1582,SEMILLA DE AMARANTO X KG,"11860,00"
,,SEMILLAS,1583,SEMILLA DE CHIA NAC X KG.,"7470,00"
,,SEMILLAS,1585,SEMILLA DE GIRASOL X KG.,"5640,00"
,,SEMILLAS,1586,SEMILLA DE LINO X KG,"4090,00"
,,SEMILLAS,1587,SEMILLA DE ZAPALLO PELADO X KG.,"16940,00"
,,SEMILLAS,1589,SESAMO BLANCO X KG.,"7290,00"
,,SEMILLAS,1591,SESAMO NEGRO X KG,"12000,00"
,,SNACK,1794,MANI TOSTADO A GRANEL X KG,"2910,00"
,,SNACK,2014,BARRA MUECAS X45GR,"1770,00"
,,SNACK,2074,"BARRAS ""CRUDDA""  X40Gr - SIN TACC","1850,00"
,,SUPLEMENTOS,2076,"CITRATO DE MAGNESIO ""EL  NATURALISTA""","6290,00"
,,SUPLEMENTOS,2077,"CITRATO DE POTASIO ""EL NATURALISTA""","5660,00"
,,SUPLEMENTOS,2078,"GLICINATO DE MAGNESIO ""EL NATURALISA""","6060,00"
,,SUPLEMENTOS,2079,"ZINC ""EL NATURALISTA""","6050,00"
,,SUPLEMENTOS,2080,"CARDOMARIANO ""EL NATURALISTA""","10780,00"
,,SUPLEMENTOS,2082,"GINKGO BILOBA FORTE X  COMP. ""EL NATURALISTA""","1940,00"
,,SUPLEMENTOS,2083,"VITAMINA E X 10 COMP. ""EL NATURALISTA""","2000,00"
,,SUPLEMENTOS,2085,"PROPOLEO EXT LIQUIDO X 30ml""el naturalista""","3130,00"
,,SUPLEMENTOS,2168,"REDUCTOR BLISTER  X 10 COMP.""EL NATURALISTA""","2260,00"
,,SUPLEMENTOS,2169,"CURCUMA ACTIVADA CON PIMIENTA X 30 COMP. ""EL NATURALISTA""","5560,00"
,,SUPLEMENTOS,2175,"VALERIANA BLISTER  X 10 COMP. ""EL NATURALISTA""","1890,00"
,,SUPLEMENTOS,2211,"POTASIO + MAGNESIO X 30 ""EL NATURALISTA""","6170,00"
,,SUPLEMENTOS,2212,"RESVERATROL X 30 ""EL NATURALISTA""","8860,00"
,,SUPLEMENTOS,2213,"VITAMINA B12 X 30 ""EL NATURALISTA""","7250,00"
,,SUPLEMENTOS,2214,"ARANDANOS X 30 COMP EL NATURALISTA""","6990,00"
,,SUPLEMENTOS,2216,"CAFE VERDE X 30 ""EL NATURALISTA""","6180,00"
,,SUPLEMENTOS,2217,"FLEBOTONICO X 30 ""EL NATURALISTA""","6350,00"
,,SUPLEMENTOS,2218,"CAROTENO X 10 ""EL NATURALISTA""","2010,00"
,,SUPLEMENTOS,2221,PROPOLEO LIQ X 100 ML,"6940,00"
,,SUPLEMENTOS,2222,"COLAGENO X 10 ""EL NATURALISTA""","2030,00"
,,SUPLEMENTOS,2311,"VITAMINA C ""EL NATURALISTA"" X 60 COMP","7450,00"
,,TOMATE TRITURADO,1625,TOMATE TRITURADO 12 X 500 CC,"11000,00"
,,TOMATE TRITURADO,1626,TOMATE TRITURADO 8 X 1 KG,"9000,00"
,,TOMATE TRITURADO,1630,TOMATE CONDIM X 1 KG,"3330,00"
,,VINOS,1159,MASTROENI CABERNET FRANC X 750 CC ,"4750,00"
,,VINOS,1162,MASTROENI CABERNET X 5 LITROS ,"8980,00"
,,VINOS,1177,MASTROENI CASA DE BARRO X 5 L,"8190,00"
,,VINOS,1194,MASTROENI CHAMPAÑA X 750 CC ,"6030,00"
,,VINOS,1231,CORDERO CON PIEL DEL LOBO X 750CC,"4740,00"
,,VINOS,1265,MASTROENI ESP DULCE NATURAL X 750 CC ,"6480,00"
,,VINOS,1337,LA IRIDE CAB ROJO X 750 CC.,"4230,00"
,,VINOS,1338,LA IRIDE CAB SAUV PLATA X 750 CC,"3590,00"
,,VINOS,1341,LA IRIDE CAJA BIB CABERNET,"17150,00"
,,VINOS,1342,LA IRIDE CAJA BIB MALBEC,"17150,00"
,,VINOS,1344,LA IRIDE CHARD ROJO X 750 CC.,"4230,00"
,,VINOS,1345,LA IRIDE MALBEC PARTIDA SELEC X 750 CC.,"5420,00"
,,VINOS,1346,LA IRIDE MALBEC PLATA X 750 CC,"3590,00"
,,VINOS,1347,LA IRIDE MALBEC ROJO X 750 CC.,"4230,00"
,,VINOS,1348,LA IRIDE MALBEC X 5 LTROS.,"11030,00"
,,VINOS,1369,MASTROENI MALBEC NOTABLE X 750 CC ,"4750,00"
,,VINOS,1370,MASTROENI MALBEC R VENDIM X 5 L,"0,00"
,,VINOS,1371,MASTROENI MALBEC ROBLE X 5 L,"10040,00"
,,VINOS,1372,MASTROENI MALBEC X 5 LITROS ,"8980,00"
,,VINOS,1411,CROTTA MISTELA  X 2 LTS,"9920,00"
,,VINOS,1412,CROTTA MISTELA  X 750 CC,"6420,00"
,,VINOS,1475,CABARCENO PATERO BCO 6 X 750 CC,"10570,00"
,,VINOS,1478,CROTTA PATERO  X 5 LITROS,"9530,00"
,,VINOS,1480,CABARCENO PATERO TTO 6 X 750 CC,"10580,00"
,,VINOS,1492,PERRO CALLEJERO MALBEC X 750CC,"6980,00"
,,VINOS,1579,MASTROENI SAUV BLANC X 5 LTS ,"8980,00"
,,VINOS,1642,CROTTA VINO BLANCO  X 5 LTS.,"9270,00"
,,VINOS,1643,CROTTA VINO TINTO X 5 LTS,"9270,00"
,,VINOS,1704,LAS PERDICES MALBEC X 750,"7190,00"
,,VINOS,1705,LAS PERDICES CAB SAUV X 750,"7190,00"
,,VINOS,1706,LAS PERDICES SAUVI BLANC X 750,"7190,00"
,,VINOS,1707,LAS PERDICES PARTRIDGE MALBEC X 750,"5200,00"
,,VINOS,1708,LAS PERDICES PARTRIDGE CHARDONNAY X 750,"5200,00"
,,VINOS,1709,LAS PERDICES RESERVA MALBEC X 750,"10880,00"
,,VINOS,1710,LAS PERDICES RESERVA CHARDONNAY X 750,"10880,00"
,,VINOS,1711,LAS PERDICES ALA COLORADA ANCELLOTA X 750,"14430,00"
,,VINOS,1712,LAS PERDICES EXTRA BRUT CORTO X 750,"8660,00"
,,VINOS,1713,LAS PERDICES BRUT ROSÉ X 750,"7850,00"
,,VINOS,1714,LAS PERDICES BIB PARTRIDGE MALBEC X 3 L,"15580,00"
,,VINOS,1898,"LA IRIDE ""HUELGA DE AMORES"" X 750ml","4690,00"
,,VINOS,2088,MARCIANO WINE MALBEC,"7500,00"
,,VINOS,2230,PERRO CALLEJERO SAUV BLANC X 750,"6980,00"
,,VINOS,2270,LAS PERDICES PARTRIDGE ESPUMANTE X 750,"6520,00"
,,VINOS,2404,VARGAS LINARES MALBEC,"2900,00"